objectid;cod_ibge;cod_ses;cod_regiao_uf;macrorregiao_saude;regiao_saude;nome_regiao_saude;crs;municipio;cod_cnes;nome_da_unidade;telefone;nome_razao_social;cod_tipo_un;ds_tipo_un;ds_natureza;tp_gestao;latitude;longitude;equipamento;complemento;cep;endereco;adulto_leito_uti;status
180;4316006;431600;462;Metropolitana;6;REGIÃO 06 - VALE DO PARANHANA E COSTA SERRA;01ª CRS;Rolante;2257564;FUNDACAO HOSPITALAR DE ROLANTE;;FUNDACAO HOSPITALAR DE ROLANTE;5;HOSPITAL GERAL;ENTIDADES SEM FINS LUCRATIVOS;ESTADUAL;-29.65307;-50.575823;Hospital; ;95690-000;RUA CARLOS HUFF, 150 - CENTRO;;ATIVO
137;4315008;431500;470;Missioneira;14;REGIÃO 14 - FRONTEIRA NOROESTE;14ª CRS;Porto Lucena;2250810;HOSPITAL SAO JOSE PORTO LUCENA RS;;SOCIEDADE HOSPITAL SAO JOSE;5;HOSPITAL GERAL;ENTIDADES SEM FINS LUCRATIVOS;DUPLA;-27.857193;-55.011288;Hospital;CASA;98980-000;AVN ALMIRANTE GUILHOBEL, 87 - CENTRO;;ATIVO
172;4300646;430064;471;Norte;15;REGIÃO 15 - CAMINHO DAS ÁGUAS;02ª CRS;Ametista do Sul;2228629;HOSPITAL SAO GABRIEL AMETISTA DO SUL;;SOCIEDADE HOSPITALAR S GABRIEL AMETISTA DO SUL;5;HOSPITAL GERAL;ENTIDADES SEM FINS LUCRATIVOS;ESTADUAL;-27.366095;-53.176949;Hospital; ;98465-000;RUA JOAO DE LUCA, 339 - JOAO DE LUCA;;ATIVO
174;4313409;431340;463;Metropolitana;7;REGIÃO 07 - VALE DOS SINOS;01ª CRS;Novo Hamburgo;2232146;FUNDACAO DE SAUDE PUBLICA DE NOVO HAMBURGO FSNH;;FUNDACAO DE SAUDE PUBLICA DE NOVO HAMBURGO FSNH;5;HOSPITAL GERAL;ADMINISTRAÇÃO PÚBLICA;MUNICIPAL;-29.675048;-51.131987;Hospital; ;93310-003;AVN PEDRO ADAMS FILHO, 6520 - OPERARIO;10.0;ATIVO
191;4307005;430700;472;Norte;16;REGIÃO 16 - ALTO URUGUAI GAÚCHO;11ª CRS;Erechim;9142118;SANTA MONICA HOSPITAL;;HOSPITAL SANTA MONICA LTDA;5;HOSPITAL GERAL;ENTIDADES EMPRESARIAIS;MUNICIPAL;-27.636636;-52.282731;Hospital;SALA 103;99711-010;RUA ITALIA, 878 - ESPIRITO SANTO;;ATIVO
208;4314704;431470;471;Norte;15;REGIÃO 15 - CAMINHO DAS ÁGUAS;02ª CRS;Planalto;2228556;HOSPITAL MEDIANEIRA PLANALTO;;ASSOCIACAO BENEFICIENTE NOSSA SENHORA MEDIANEIRA;5;HOSPITAL GERAL;ENTIDADES SEM FINS LUCRATIVOS;ESTADUAL;-27.333406;-53.061844;Hospital; ;98470-000;RUA HUMBERTO DE CAMPOS, 661 - CCENTRO;;ATIVO
214;4318200;431820;462;Metropolitana;6;REGIÃO 06 - VALE DO PARANHANA E COSTA SERRA;01ª CRS;São Francisco de Paula;2227770;HOSPITAL SAO FRANCISCO DE PAULA;;HOSPITAL SAO FRANCISCO DE PAULA;5;HOSPITAL GERAL;ENTIDADES SEM FINS LUCRATIVOS;ESTADUAL;-29.448053;-50.583489;Hospital; ;95400-000;RUA FREDERICO TEDESCO, 117 - CENTRO;;ATIVO
224;4316907;431690;457;Centro-Oeste;1;REGIÃO 01 - VERDES CAMPOS;04ª CRS;Santa Maria;2244292;HOSPITAL SAO FRANCISCO DE ASSIS SANTA MARIA;;ASSOCIACAO FRANCISCANA DE ASSISTENCIA A SAUDE;5;HOSPITAL GERAL;ENTIDADES SEM FINS LUCRATIVOS;MUNICIPAL;-29.69565;-53.791378;Hospital; ;97060-360;RUA JOANA DARC, 465 - N S DE LOURDES;10.0;ATIVO
225;4308003;430800;457;Centro-Oeste;1;REGIÃO 01 - VERDES CAMPOS;04ª CRS;Faxinal do Soturno;2244101;HOSPITAL DE CARIDADE SAO ROQUE FAXINAL DO SOTURNO;;HOSPITAL DE CARIDADE SAO ROQUE;5;HOSPITAL GERAL;ENTIDADES SEM FINS LUCRATIVOS;ESTADUAL;-29.576934;-53.438927;Hospital; ;97220-000;RUA DONA CECI LEITE COSTA, 1266 - CENTRO;;ATIVO
232;4316907;431690;457;Centro-Oeste;1;REGIÃO 01 - VERDES CAMPOS;04ª CRS;Santa Maria;9575936;HOSPITAL REGIONAL DE SANTA MARIA;;SECRETARIA DA SAUDE;5;HOSPITAL GERAL;ADMINISTRAÇÃO PÚBLICA;ESTADUAL;-29.705929;-53.863242;Hospital; ;97030-220;RUA FLORIANOPOLIS, 1041 - PINHEIRO MACHADO;;ATIVO
244;4310801;431080;463;Metropolitana;7;REGIÃO 07 - VALE DOS SINOS;01ª CRS;Ivoti;2232189;HOSPITAL SAO JOSE IVOTI;;ASSOCIACAO CONGREGACAO DE SANTA CATARINA;5;HOSPITAL GERAL;ENTIDADES SEM FINS LUCRATIVOS;ESTADUAL;-29.591931;-51.160288;Hospital; ;93900-000;AV PRESIDENTE LUCENA, 3598 - CENTRO;;ATIVO
254;4314209;431420;477;Sul;21;REGIÃO 21 - SUL;03ª CRS;Pedro Osório;2233339;SANTA CASA DE MISERICORDIA DE PEDRO OSORIO;;SANTA CASA DE MISERICORDIA DE PEDRO OSORIO;5;HOSPITAL GERAL;ENTIDADES SEM FINS LUCRATIVOS;ESTADUAL;-31.864258;-52.823122;Hospital; ;96360-000;RUA ARZELINDO FERREIRA, 33 - CENTRO;;ATIVO
255;4320107;432010;476;Norte;20;REGIÃO 20 - ROTA DA PRODUÇÃO;15ª CRS;Sarandi;2235404;HOSPITAL COMUNITARIO SARANDI;;HOSPITAL COMUNITARIO SARANDI;5;HOSPITAL GERAL;ENTIDADES SEM FINS LUCRATIVOS;ESTADUAL;-27.941057;-52.927805;Hospital;CAS;99560-000;COSMO FAVRETTO, 676 - CENTRO;;ATIVO
260;4301602;430160;478;Sul;22;REGIÃO 22 - PAMPA;07ª CRS;Bagé;2261987;SANTA CASA DE CARIDADE DE BAGE;;SANTA CASA DE CARIDADE DE BAGE;5;HOSPITAL GERAL;ENTIDADES SEM FINS LUCRATIVOS;ESTADUAL;-31.326318;-54.111048;Hospital;CASA;96400-130;RUA GOMES CARNEIRO, 1350 - CENTRO;;ATIVO
264;4313904;431390;469;Missioneira;13;REGIÃO 13 - DIVERSIDADE;17ª CRS;Panambi;2254956;HOSPITAL PANAMBI;;SOCIEDADE HOSPITAL PANAMBI;5;HOSPITAL GERAL;ENTIDADES SEM FINS LUCRATIVOS;MUNICIPAL;-28.289957;-53.49228;Hospital; ;98280-000;RUA BENJAMIN CONSTANT, 490 - MEDIANEIRA;;ATIVO
284;4314902;431490;466;Metropolitana;10;REGIÃO 10 - CAPITAL E VALE DO GRAVATAÍ;01ª CRS;Porto Alegre;3006522;HOSPITAL MOINHOS DE VENTO;;ASSOCIACAO HOSPITALAR MOINHOS DE VENTO;5;HOSPITAL GERAL;ENTIDADES SEM FINS LUCRATIVOS;MUNICIPAL;-30.02631;-51.209105;Hospital; ;90035-001;RUA RAMIRO BARCELOS, 910 - MOINHOS DE VENTO;56.0;ATIVO
308;4320800;432080;475;Norte;19;REGIÃO 19 - BOTUCARAÍ;06ª CRS;Soledade;2246961;HOSPITAL FREI CLEMENTE - SOLEDADE;;HOSPITAL DE CARIDADE FREI CLEMENTE;5;HOSPITAL GERAL;ENTIDADES SEM FINS LUCRATIVOS;ESTADUAL;-28.809979;-52.510941;Hospital; ;99300-000;AV PINHEIRO MACHADO, 828 - CENTRO;;ATIVO
293;4312658;431265;473;Norte;17;REGIÃO 17 - PLANALTO;06ª CRS;Não-Me-Toque;2246910;HOSPITAL ALTO JACUI - NAO ME TOQUE;;HOSPITAL BENEFICENCIA ALTO JACUI;5;HOSPITAL GERAL;ENTIDADES SEM FINS LUCRATIVOS;ESTADUAL;-28.460816;-52.821731;Hospital; ;99470-000;AV DR WALDOMIRO GRAEFF, 810 - CENTRO;;ATIVO
305;4318804;431880;477;Sul;21;REGIÃO 21 - SUL;03ª CRS;São Lourenço do Sul;2233312;SANTA CASA DE MISERIC S LOURENCO DO SUL;;SANTA CASA DE MISERICORDIA DE SAO LOURENCO DO SUL;5;HOSPITAL GERAL;ENTIDADES SEM FINS LUCRATIVOS;ESTADUAL;-31.364671;-51.97842;Hospital;CASA;96170-000;RUA ALMIRANTE ABREU, 437 - CENTRO;;ATIVO
309;4314027;431402;457;Centro-Oeste;1;REGIÃO 01 - VERDES CAMPOS;04ª CRS;Paraíso do Sul;2234467;UNIDADE MISTA HOSPITAL PARAISO;;HOSPITAL PARAISO SOCIEDADE ASSISTENCIAL E BENEFICENTE;15;UNIDADE MISTA;ENTIDADES SEM FINS LUCRATIVOS;ESTADUAL;-29.67041;-53.144041;Hospital; ;96530-000;RUA THEODOR WURTH, 208 - VILA PARAISO;;ATIVO
318;4314902;431490;466;Metropolitana;10;REGIÃO 10 - CAPITAL E VALE DO GRAVATAÍ;01ª CRS;Porto Alegre;6295320;AESC HOSPITAL SANTA ANA;;ASSOCIACAO EDUCADORA SAO CARLOS AESC;5;HOSPITAL GERAL;ENTIDADES SEM FINS LUCRATIVOS;MUNICIPAL;-30.086151;-51.206855;Hospital; ;91720-260;RUA CLEMENCIANO BARNASQUE, 733 - TERESOPOLIS;;ATIVO
329;4303004;430300;483;Vales;27;REGIÃO 27 - JACUÍ CENTRO;08ª CRS;Cachoeira do Sul;2266474;HOSPITAL DE CARIDADE E BENEFICENCIA;;HOSPITAL DE CARIDADE E BENEFICENCIA;5;HOSPITAL GERAL;ENTIDADES SEM FINS LUCRATIVOS;MUNICIPAL;-30.045546;-52.894773;Hospital; ;96508-000;RUA SALDANHA MARINHO, 48 - CENTRO;10.0;ATIVO
332;4314100;431410;473;Norte;17;REGIÃO 17 - PLANALTO;06ª CRS;Passo Fundo;2244969;HOSPITAL DE OLHOS LIONS PASSO FUNDO;;FUNDACAO HOSPITALAR OFTALMOLOGICA UNIVERSITARIA LIONS;7;HOSPITAL ESPECIALIZADO;ENTIDADES SEM FINS LUCRATIVOS;ESTADUAL;-28.233;-52.383987;Hospital;PREDIO 2 QUADRA K;99052-900;CAMPUS I,  - SAO JOSE;;ATIVO
336;4317301;431730;477;Sul;21;REGIÃO 21 - SUL;03ª CRS;Santa Vitória do Palmar;2233398;IRMANDADE S CASA DE MISERICORDIA DE S V PALMAR;;IRMANDADADE DA S CASA DE MISERICORDIA DE SV PALMAR;5;HOSPITAL GERAL;ENTIDADES SEM FINS LUCRATIVOS;ESTADUAL;-33.524364;-53.372112;Hospital; ;96230-000;DOUTOR ALIPIO SANTIAGO CORREA, 55 - CENTRO;;ATIVO
343;4313300;431330;481;Serra;25;REGIÃO 25 - VINHEDOS E BASALTO;05ª CRS;Nova Prata;2241161;HOSPITAL SAO JOAO BATISTA;;HOSPITAL SAO JOAO BATISTA;5;HOSPITAL GERAL;ENTIDADES SEM FINS LUCRATIVOS;MUNICIPAL;-28.784367;-51.612636;Hospital; ;95320-000;AV CONEGO PERES, 765 - CENTRO;;ATIVO
347;4314100;431410;473;Norte;17;REGIÃO 17 - PLANALTO;06ª CRS;Passo Fundo;2246988;HOSPITAL SAO VICENTE DE PAULO PASSO FUNDO;;ASSOCIACAO HOSPITALAR BENEFICENTE SAO VICENTE DE PAULO;5;HOSPITAL GERAL;ENTIDADES SEM FINS LUCRATIVOS;ESTADUAL;-28.259953;-52.413386;Hospital; ;99010-080;RUA TEIXEIRA SOARES, 808 - CENTRO;42.0;ATIVO
348;4314902;431490;466;Metropolitana;10;REGIÃO 10 - CAPITAL E VALE DO GRAVATAÍ;01ª CRS;Porto Alegre;2237598;HOSPITAL DIVINA PROVIDENCIA;;SOCIEDADE SULINA DIVINA PROVIDENCIAHOSPITAL DIVINA PROVIDEN;5;HOSPITAL GERAL;ENTIDADES SEM FINS LUCRATIVOS;MUNICIPAL;-30.084735;-51.18811;Hospital;GLORIA;91712-160;RUA DA GRUTA, 145 - CASCATA;12.0;ATIVO
349;4314902;431490;466;Metropolitana;10;REGIÃO 10 - CAPITAL E VALE DO GRAVATAÍ;01ª CRS;Porto Alegre;3881660;CLINICA PINEL;;ASSOCIACAO ENCARNACION BLAYA;7;HOSPITAL ESPECIALIZADO;ENTIDADES SEM FINS LUCRATIVOS;MUNICIPAL;-30.0505398;-51.2065476;Hospital;;90040-373;RUA SANTANA, 1455 - SANTANA;;ATIVO
356;4314407;431440;477;Sul;21;REGIÃO 21 - SUL;03ª CRS;Pelotas;2252376;HOSPITAL ESPIRITA DE PELOTAS;;HOSPITAL ESPIRITA DE PELOTAS;7;HOSPITAL ESPECIALIZADO;ENTIDADES SEM FINS LUCRATIVOS;MUNICIPAL;-31.752;-52.305155;Hospital;;96085-470;AV DOMINGOS DE ALMEIDA, 2969 - AREAL;;ATIVO
361;4314902;431490;466;Metropolitana;10;REGIÃO 10 - CAPITAL E VALE DO GRAVATAÍ;01ª CRS;Porto Alegre;2906163;SAO PIETRO SERVICOS DE SAUDE LTDA;;SAO PIETRO SERVICOS DE SAUDE LTDA;5;HOSPITAL GERAL;ENTIDADES EMPRESARIAIS;MUNICIPAL;-30.02237;-51.1541851;Hospital;;91360-090;ENGENHEIRO WALTER BOEHL, 285 - VILA IPIRANGA;;ATIVO
363;4300604;430060;466;Metropolitana;10;REGIÃO 10 - CAPITAL E VALE DO GRAVATAÍ;01ª CRS;Alvorada;2232081;HOSPITAL ALVORADA;;HOSPITAL ANA NERY SANTA CRUZ DO SUL;5;HOSPITAL GERAL;ENTIDADES SEM FINS LUCRATIVOS;ESTADUAL;-30.008392;-51.074397;Hospital; ;94814-300;RUA JARCI ZAMIN, 170 - TRES FIGUEIRAS;;ATIVO
366;4318903;431890;467;Missioneira;11;REGIÃO 11 - SETE POVOS DAS MISSÕES;12ª CRS;São Luiz Gonzaga;2259893;HOSPITAL SAO LUIZ GONZAGA;;SOCIEDADE HOSPITALAR SAO LUIZ GONZAGA;5;HOSPITAL GERAL;ENTIDADES SEM FINS LUCRATIVOS;ESTADUAL;-28.406928;-54.962856;Hospital; ;97800-000;RUA GENERAL PORTINHO, 1425 - CENTRO;;ATIVO
398;4301404;430140;475;Norte;19;REGIÃO 19 - BOTUCARAÍ;06ª CRS;Arvorezinha;2252163;HOSPITAL BENEFICENTE SAO JOAO - ARVOREZINHA;;HOSPITAL SAO JOAO DE ARVOREZINHA;5;HOSPITAL GERAL;ENTIDADES SEM FINS LUCRATIVOS;ESTADUAL;-28.871394;-52.179492;Hospital; ;95995-000;DALTRO FILHO, 321 - CENTRO;;ATIVO
418;4307005;430700;472;Norte;16;REGIÃO 16 - ALTO URUGUAI GAÚCHO;11ª CRS;Erechim;2249472;HOSPITAL DE CARIDADE DE ERECHIM;;HOSPITAL DE CARIDADE DE ERECHIM;5;HOSPITAL GERAL;ENTIDADES SEM FINS LUCRATIVOS;DUPLA;-27.634046;-52.268907;Hospital; ;99700-372;AV COMANDANTE KRAEMER, 405 - CENTRO;;ATIVO
426;4312708;431270;472;Norte;16;REGIÃO 16 - ALTO URUGUAI GAÚCHO;11ª CRS;Nonoai;2228688;HOSPITAL COMUNITARIO NONOAI;;SOCIEDADE HOSPITALAR COMUNITARIA E BENEFICIENTE NONOAI;5;HOSPITAL GERAL;ENTIDADES SEM FINS LUCRATIVOS;DUPLA;-27.362319;-52.773692;Hospital;PREDIO;99600-000;RUA PE MANOEL GOMES GONZALES, 395 - OPERARIO;;ATIVO
429;4317103;431710;459;Centro-Oeste;3;REGIÃO 03 - FRONTEIRA OESTE;10ª CRS;Santana do Livramento;2248220;SANTA CASA DE MISERICORDIA;;SANTA CASA DE MISERICORDIA;5;HOSPITAL GERAL;ENTIDADES SEM FINS LUCRATIVOS;MUNICIPAL;-30.889872;-55.53804;Hospital; ;97573-560;RUA MANDUCA RODRIGUES, 295 - CENTRO;10.0;ATIVO
432;4304507;430450;477;Sul;21;REGIÃO 21 - SUL;03ª CRS;Canguçu;2232928;HOSPITAL DE CARIDADE DE CANGUCU;;HOSPITAL DE CARIDADE DE CANGUCU;5;HOSPITAL GERAL;ENTIDADES SEM FINS LUCRATIVOS;DUPLA;-31.391612;-52.678538;Hospital;CASA;96600-000;RUA JOSE ALBANO DE SOUZA, 140 - CENTRO;;ATIVO
433;4320701;432070;483;Vales;27;REGIÃO 27 - JACUÍ CENTRO;08ª CRS;Sobradinho;2234408;HOSPITAL DR HOMERO SOBRADINHO;;CASA DE SAUDE DR HOMERO LIMA MENEZES LTDA;5;HOSPITAL GERAL;ENTIDADES EMPRESARIAIS;MUNICIPAL;-29.420059;-53.028699;Hospital; ;96900-000;RUA DR HOMERO LIMA MENEZES, 157 - CENTRO;;ATIVO
436;4311908;431190;472;Norte;16;REGIÃO 16 - ALTO URUGUAI GAÚCHO;11ª CRS;Marcelino Ramos;2249618;HOSPITAL CLINICAS DOUTOR SILVEIRA DE MARCELINO RAMOS;;ASSOCIACAO HOSPITALAR MARCELINENSE;5;HOSPITAL GERAL;ENTIDADES SEM FINS LUCRATIVOS;DUPLA;-27.467733;-51.91007;Hospital; ;99800-000;RUA DOUTOR JOAO DA SILVEIRA, 258 - CENTRO;;ATIVO
444;4302105;430210;481;Serra;25;REGIÃO 25 - VINHEDOS E BASALTO;05ª CRS;Bento Gonçalves;2241021;HOSPITAL TACCHINI;;ASSOCIACAO DR BARTHOLOMEU TACCHINI;5;HOSPITAL GERAL;ENTIDADES SEM FINS LUCRATIVOS;MUNICIPAL;-29.167332;-51.514586;Hospital; ;95700-000;RUA JOSE MARIO MONACO, 358 - CENTRO;26.0;ATIVO
477;4307559;430755;472;Norte;16;REGIÃO 16 - ALTO URUGUAI GAÚCHO;11ª CRS;Estação;2249626;HOSPITAL SANTO ANTONIO ESTACAO;;HOSPITAL SANTO ANTONIO LTDA;5;HOSPITAL GERAL;ENTIDADES SEM FINS LUCRATIVOS;ESTADUAL;-27.913072;-52.257231;Hospital; ;99930-000;RUA LIDO TAGLIARI, 931 - CENTRO;;ATIVO
478;4303608;430360;462;Metropolitana;6;REGIÃO 06 - VALE DO PARANHANA E COSTA SERRA;01ª CRS;Cambará do Sul;5602742;FUNDACAO HOSPITALAR SAO JOSE;;FUNDACAO HOSPITALAR SAO JOSE;5;HOSPITAL GERAL;ENTIDADES SEM FINS LUCRATIVOS;ESTADUAL;-29.050444;-50.148009;Hospital;PREDIO;95480-000;RUA PADRE JOAO PAZZA, 315 - CENTRO;;ATIVO
505;4312401;431240;464;Metropolitana;8;REGIÃO 08 - VALE DO CAÍ E METROPOLITANA;01ª CRS;Montenegro;2227959;HOSPITAL UNIMED VALE DO CAI;;UNIMED VALE DO CAI SOC COOP DE SERV DE SAUDE LTDA;5;HOSPITAL GERAL;ENTIDADES EMPRESARIAIS;MUNICIPAL;-29.694046;-51.480275;Hospital; ;95780-000;RUA JULIO RENNER, 450 - TIMBAUVA;9.0;ATIVO
528;4307500;430750;475;Norte;19;REGIÃO 19 - BOTUCARAÍ;06ª CRS;Espumoso;2246813;HOSPITAL SAO SEBASTIAO - ESPUMOSO;;CONGREGACAO DE NOSSA SENHORA;5;HOSPITAL GERAL;ENTIDADES SEM FINS LUCRATIVOS;ESTADUAL;-28.726173;-52.845453;Hospital; ;99400-000;RUA PADRE REUS, 80 - CENTRO;;ATIVO
542;4313607;431360;474;Norte;18;REGIÃO 18 - ARAUCÁRIAS;06ª CRS;Paim Filho;2247046;HOSPITAL SANTA TEREZINHA - PAIM FILHO;;HOSPITAL SANTA TEREZINHA;5;HOSPITAL GERAL;ENTIDADES SEM FINS LUCRATIVOS;ESTADUAL;-27.707893;-51.763246;Hospital; ;99850-000;RUA DR MILTON MICHELIN, 39 - CENTRO;;ATIVO
545;4319901;431990;463;Metropolitana;7;REGIÃO 07 - VALE DOS SINOS;01ª CRS;Sapiranga;2232154;HOSPITAL SAPIRANGA;;SOCIEDADE BENEFICENTE SAPIRANGUENSE;5;HOSPITAL GERAL;ENTIDADES SEM FINS LUCRATIVOS;ESTADUAL;-29.64065;-51.006992;Hospital; ;93800-000;GETULIO VARGAS, 527 - CENTRO;7.0;ATIVO
550;4301206;430120;483;Vales;27;REGIÃO 27 - JACUÍ CENTRO;08ª CRS;Arroio do Tigre;2234424;HOSPITAL SANTA ROSA DE LIMA;;ASSOCIACAO BENEFICENTE SANTA ROSA DE LIMA;5;HOSPITAL GERAL;ENTIDADES SEM FINS LUCRATIVOS;ESTADUAL;-29.334813;-53.091997;Hospital; ;96950-000;RUA DOM GUILHERME MULLER, 932 - CENTRO;;ATIVO
570;4320503;432050;473;Norte;17;REGIÃO 17 - PLANALTO;06ª CRS;Sertão;2246805;HOSPITAL SAO JOSE - SERTAO;;HOSPITAL SAO JOSE;5;HOSPITAL GERAL;ENTIDADES SEM FINS LUCRATIVOS;ESTADUAL;-27.988196;-52.25962;Hospital; ;99170-000;AV GEN ERNESTO DORNELES, 1041 - CENTRO;;ATIVO
598;4314407;431440;477;Sul;21;REGIÃO 21 - SUL;03ª CRS;Pelotas;2252694;HOSPITAL ESCOLA DA UNIVERSIDADE FEDERAL DE PELOTAS;;HOSPITAL ESCOLA DA UFPEL FUNDACAO DE APOIO UNIVERSITARIO;5;HOSPITAL GERAL;ENTIDADES EMPRESARIAIS;MUNICIPAL;-31.764721;-52.346979;Hospital; ;96020-360;RUA PROFESSOR ARAUJO, 538 - CENTRO;5.0;ATIVO
606;4313805;431380;471;Norte;15;REGIÃO 15 - CAMINHO DAS ÁGUAS;02ª CRS;Palmitinho;2228580;HOSPITAL SANTA TEREZINHA PALMITINHO;;HOSPITAL SANTA TEREZINHA DE PALMITINHO;5;HOSPITAL GERAL;ENTIDADES SEM FINS LUCRATIVOS;ESTADUAL;-27.356581;-53.556614;Hospital;PREDIO;98430-000;RUA CARLOS GOMES, 320 - CENTRO;;ATIVO
629;4305108;430510;479;Serra;23;REGIÃO 23 - CAXIAS E HORTÊNSIAS;05ª CRS;Caxias do Sul;2223546;HOSPITAL POMPEIA;;PIO SODALICIO DAS DAMAS DE CARIDADE DE CAXIAS DO SUL;5;HOSPITAL GERAL;ENTIDADES SEM FINS LUCRATIVOS;MUNICIPAL;-29.167374;-51.183618;Hospital; ;95010-005;AV JULIO DE CASTILHOS, 2163 - CENTRO;30.0;ATIVO
634;4301503;430150;469;Missioneira;13;REGIÃO 13 - DIVERSIDADE;17ª CRS;Augusto Pestana;2261081;HOSPITAL SAO FRANCISCO;;ASSOCIACAO PROTETORA HOSPITAL SAO FRANCISCO;5;HOSPITAL GERAL;ENTIDADES SEM FINS LUCRATIVOS;ESTADUAL;-28.51767;-53.988815;Hospital; ;98740-000;RUA DR OROZIMBO SAMPAIO, 0 - CENTRO;;ATIVO
641;4309308;430930;465;Metropolitana;9;REGIÃO 09 - CARBONÍFERA/COSTA DOCE;01ª CRS;Guaíba;181927;ASSOCIACAO HOSPITALAR VILA NOVA GUAIBA;;ASSOCIACAO HOSPITALAR VILA NOVA;5;HOSPITAL GERAL;ENTIDADES SEM FINS LUCRATIVOS;ESTADUAL;-30.1134188;-51.3313706;Hospital;HOSPITAL;92704-305;RUA SAO PAULO, 800 - CENTRO;;ATIVO
647;4314902;431490;466;Metropolitana;10;REGIÃO 10 - CAPITAL E VALE DO GRAVATAÍ;01ª CRS;Porto Alegre;5029880;DIAGLASER CENTRO DE DIAGNOSTICO E HOSPITAL DIA LTDA;;DIAGLASER CENTRO DE DIAGNOSTICO E HOSPITAL DIA LTDA;62;HOSPITAL/DIA - ISOLADO;ENTIDADES EMPRESARIAIS;MUNICIPAL;-30.046;-51.207859;Hospital;SALA 1302;90620-130;RUA GOMES JARDIM, 301 - SANTANA;;ATIVO
654;4320305;432030;468;Missioneira;12;REGIÃO 12 - PORTAL DAS MISSÕES;09ª CRS;Selbach;2238810;HOSPITAL SAO JACOB;;SOCIEDADE HOSPITALAR SAO JACOB;5;HOSPITAL GERAL;ENTIDADES SEM FINS LUCRATIVOS;ESTADUAL;-28.62769;-52.953545;Hospital; ;99450-000;RUA 15 DE NOVEMBRO, 153 - CENTRO;;ATIVO
657;4314605;431460;477;Sul;21;REGIÃO 21 - SUL;03ª CRS;Piratini;2233347;HOSPITAL DE CARIDADE NOSSA SENHORA DA CONCEICAO PIRATINI;;HOSPITAL DE CARIDADE NOSSA SENHORA DA CONCEICAO;5;HOSPITAL GERAL;ENTIDADES SEM FINS LUCRATIVOS;ESTADUAL;-31.448959;-53.107318;Hospital; ;96490-000;AVENIDA SEIS DE JULHO, 42 - CENTRO;;ATIVO
672;4300034;430003;478;Sul;22;REGIÃO 22 - PAMPA;07ª CRS;Aceguá;2262010;HOSPITAL DA COLONIA NOVA;;COMUNIDADE DA COLONIA NOVA HOSPITAL;5;HOSPITAL GERAL;ENTIDADES SEM FINS LUCRATIVOS;ESTADUAL;-31.665742;-54.068925;Hospital; ;96445-000;POSTO CORREIO DA COLONIA NOVA, 10 - CENTRO;;ATIVO
684;4303707;430370;470;Missioneira;14;REGIÃO 14 - FRONTEIRA NOROESTE;14ª CRS;Campina das Missões;2250802;HOSPITAL CAMPINA;;ASSOC ASSIST CULT E HOSP PE BENEDITO MEISTER C MISSOES;5;HOSPITAL GERAL;ENTIDADES SEM FINS LUCRATIVOS;DUPLA;-27.990951;-54.838916;Hospital;CASA;98975-000;RUA SANTA MARIA, 744 - CENTRO;;ATIVO
689;4314100;431410;473;Norte;17;REGIÃO 17 - PLANALTO;06ª CRS;Passo Fundo;6010830;HOSPITAL ORTOPEDICO DE PASSO FUNDO;;ASSOC HOSPITALAR ORTOPEDICA E TRAUMATOLOGICA DE PASSO FUNDO;7;HOSPITAL ESPECIALIZADO;ENTIDADES SEM FINS LUCRATIVOS;MUNICIPAL;-28.25661063;-52.41773071;Hospital;;99010121;AVENIDA SETE DE SETEMBRO, 817 - CENTRO;;ATIVO
694;4321501;432150;460;Metropolitana;4;REGIÃO 04 - BELAS PRAIAS;18ª CRS;Torres;2707950;HOSPITAL BENEFICENTE NOSSA SENHORA DOS NAVEGANTES;;ASSOCIACAO EDUCADORA SAO CARLOS;5;HOSPITAL GERAL;ENTIDADES SEM FINS LUCRATIVOS;ESTADUAL;-29.335034;-49.728047;Hospital; ;95560-000;MANOEL JOSE DE MATOS PEREIRA, 260 - CENTRO;5.0;ATIVO
715;4322103;432210;470;Missioneira;14;REGIÃO 14 - FRONTEIRA NOROESTE;14ª CRS;Tucunduva;5050170;HOSPITAL DR OSVALDO TEIXEIRA;;ASSOCIACAO HOSPITALAR TUCUNDUVA E NOVO MACHADO;5;HOSPITAL GERAL;ENTIDADES SEM FINS LUCRATIVOS;DUPLA;-27.659532;-54.443542;Hospital;PREDIO;98930-000;RUA SAO LUIZ, 96 - CENTRO;;ATIVO
738;4302907;430290;458;Centro-Oeste;2;REGIÃO 02 - ENTRE RIOS;04ª CRS;Cacequi;5699525;INSTITUTO DE SAUDE E EDUCACAO VIDA CACEQUI;;INSTITUTO DE SAUDE E EDUCACAO VIDA;5;HOSPITAL GERAL;ENTIDADES SEM FINS LUCRATIVOS;ESTADUAL;-29.875475;-54.824761;Hospital; ;97450-000;AVN OSVALDO ARANHA, 550 - CENTRO;;ATIVO
740;4314902;431490;466;Metropolitana;10;REGIÃO 10 - CAPITAL E VALE DO GRAVATAÍ;01ª CRS;Porto Alegre;2265052;HOSPITAL FEMINA SA;;HOSPITAL FEMINA SA;7;HOSPITAL ESPECIALIZADO;ENTIDADES EMPRESARIAIS;MUNICIPAL;-30.029288;-51.206837;Hospital; ;90430-001;RUA MOSTARDEIRO, 17 - RIO BRANCO;4.0;ATIVO
745;4303509;430350;465;Metropolitana;9;REGIÃO 09 - CARBONÍFERA/COSTA DOCE;01ª CRS;Camaquã;2257548;HOSPITAL NOSSA SENHORA APARECIDA DE CAMAQUA;;FUNDACAO ASSISTENCIAL E BENEFICENTE DE CAMAQUA;5;HOSPITAL GERAL;ENTIDADES SEM FINS LUCRATIVOS;ESTADUAL;-30.84837877;-51.81483847;Hospital; ;96180-000;RUA CRISTOVAO GOMES DE ANDRADE, 630 - CENTRO;;ATIVO
753;4308458;430845;468;Missioneira;12;REGIÃO 12 - PORTAL DAS MISSÕES;09ª CRS;Fortaleza dos Valos;2263866;HOSPITAL MUNICIPAL BOM PASTOR;;HOSPITAL MUNICIPAL BOM PASTOR;5;HOSPITAL GERAL;ADMINISTRAÇÃO PÚBLICA;MUNICIPAL;-28.792395;-53.217124;Hospital; ;98125-000;RUA FACCO, 853 - CENTRO;;ATIVO
754;4304200;430420;484;Vales;28;REGIÃO 28 - VINTE E OITO;13ª CRS;Candelária;2236362;HOSPITAL CANDELARIA;;SOCIEDADE BENEFICENTE HOSPITAL CANDELARIA;5;HOSPITAL GERAL;ENTIDADES SEM FINS LUCRATIVOS;MUNICIPAL;-29.666203;-52.792305;Hospital; ;96935-000;AV MARECHAL DEODORO, 1279 - CENTRO;;ATIVO
773;4305702;430570;469;Missioneira;13;REGIÃO 13 - DIVERSIDADE;17ª CRS;Condor;2261111;HOSPITAL DE CONDOR;;SOCIEDADE HOSPITAL BENEFICENTE DE CONDOR;5;HOSPITAL GERAL;ENTIDADES SEM FINS LUCRATIVOS;DUPLA;-28.209374;-53.489266;Hospital; ;98290-000;RUA GERMANO KELLER, 66 - CENTRO;;ATIVO
789;4310207;431020;469;Missioneira;13;REGIÃO 13 - DIVERSIDADE;17ª CRS;Ijuí;2261030;HOSPITAL BOM PASTOR IJUI;;ASSOCIACAO HOSPITAL BOM PASTOR IJUI;5;HOSPITAL GERAL;ENTIDADES SEM FINS LUCRATIVOS;ESTADUAL;-28.393604;-53.896449;Hospital; ;98700-000;AV DAVID JOSE MARTINS, 1376 - HAMMASTRON;;ATIVO
829;4317509;431750;467;Missioneira;11;REGIÃO 11 - SETE POVOS DAS MISSÕES;12ª CRS;Santo Ângelo;7151888;HOSPITAL REGIONAL UNIMED MISSOES;;UNIMED MISSOES RS COOPERATIVA DE ASSISTENCIA A SAUDE LTDA;5;HOSPITAL GERAL;ENTIDADES EMPRESARIAIS;MUNICIPAL;-28.310648;-54.258597;Hospital; ;98801-029;AVENIDA RIO GRANDE DO SUL, 1133 - AVANCO;7.0;ATIVO
831;4308409;430840;457;Centro-Oeste;1;REGIÃO 01 - VERDES CAMPOS;04ª CRS;Formigueiro;2244217;HOSPITAL MUNICIPAL PEDRO CALIL;;PREFEITURA MUNICIPAL DE FORMIGUEIRO;5;HOSPITAL GERAL;ADMINISTRAÇÃO PÚBLICA;ESTADUAL;-30.000602;-53.495785;Hospital; ;97210-000;RUA ADELINO CARDOSO, 150 - CENTRO;;ATIVO
855;4310603;431060;459;Centro-Oeste;3;REGIÃO 03 - FRONTEIRA OESTE;10ª CRS;Itaqui;2248271;HOSPITAL SAO PATRICIO DE ITAQUI;;HOSPITAL SAO PATRICIO DE ITAQUI;5;HOSPITAL GERAL;ENTIDADES SEM FINS LUCRATIVOS;ESTADUAL;-29.136754;-56.54004;Hospital; ;97650-000;RUA SAO FRANCISCO, 694 - CIDADE ALTA;;ATIVO
861;4300406;430040;459;Centro-Oeste;3;REGIÃO 03 - FRONTEIRA OESTE;10ª CRS;Alegrete;2248328;SANTA CASA DE ALEGRETE;;IRMANDADE DA SANTA CASA DE CARIDADE ALEGRETE;5;HOSPITAL GERAL;ENTIDADES SEM FINS LUCRATIVOS;ESTADUAL;-29.774827;-55.791042;Hospital; ;97541-260;RUA GENERAL SAMPAIO, 88 - VILA NOVA;;ATIVO
862;4316907;431690;457;Centro-Oeste;1;REGIÃO 01 - VERDES CAMPOS;04ª CRS;Santa Maria;5433509;HOSPITAL GERAL UNIMED SANTA MARIA;;UNIMED SANTA MARIA RS COOP DE ASSISTENCIA A SAUDE LTDA;5;HOSPITAL GERAL;ENTIDADES EMPRESARIAIS;MUNICIPAL;-29.687203;-53.815489;Hospital; ;97010-000;RUA VENANCIO AIRES, 1078 - CENTRO;;ATIVO
865;4309407;430940;481;Serra;25;REGIÃO 25 - VINHEDOS E BASALTO;05ª CRS;Guaporé;2793237;ASSOCIACAO HOSPITALAR MANOEL FRANCISCO GUERREIRO;;ASSOCIACAO HOSPITALAR MANOEL FRANCISCO GUERREIRO;5;HOSPITAL GERAL;ENTIDADES SEM FINS LUCRATIVOS;MUNICIPAL;-28.848289;-51.885799;Hospital; ;99200-000;RUA DR JOAO MANOEL PEREIRA, 951 - CENTRO;;ATIVO
904;4313003;431300;485;Vales;29;REGIÃO 29 - VALES E MONTANHAS;16ª CRS;Nova Bréscia;2252112;HOSPITAL SAO JOAO BATISTA NOVA BRESCIA;;ASSOCIACAO HOSPITALAR SAO JOAO BATISTA;5;HOSPITAL GERAL;ENTIDADES SEM FINS LUCRATIVOS;MUNICIPAL;-29.214601;-52.025573;Hospital; ;95950-000;AVENIDA BENTO GONCALVES, 1184 - CENTRO;;ATIVO
911;4314100;431410;473;Norte;17;REGIÃO 17 - PLANALTO;06ª CRS;Passo Fundo;2246996;HOSPITAL MUNICIPAL - PASSO FUNDO;;HOSPITAL BENEFICENTE DR CESAR SANTOS;5;HOSPITAL GERAL;ADMINISTRAÇÃO PÚBLICA;ESTADUAL;-28.258439;-52.393919;Hospital; ;99010-640;RUA ALCIDES MOURA, 100 - POPULAR;;ATIVO
913;4314902;431490;466;Metropolitana;10;REGIÃO 10 - CAPITAL E VALE DO GRAVATAÍ;01ª CRS;Porto Alegre;9570047;HOSPITAL BDW;;HOSPITAL BDW S A;5;HOSPITAL GERAL;ENTIDADES EMPRESARIAIS;MUNICIPAL;-30.045762;-51.207889;Hospital;102;90620-130;RUA GOMES JARDIM, 221 - SANTANA;;ATIVO
920;4313409;431340;463;Metropolitana;7;REGIÃO 07 - VALE DOS SINOS;01ª CRS;Novo Hamburgo;533696;HOSPITAL UNIMED VALE DO SINOS TORRE II - NOVO HAMBURGO;;UNIMED VALE DO SINOS COOPERATIVA DE ASSISTENCIA A SAUDE LT;5;HOSPITAL GERAL;ENTIDADES EMPRESARIAIS;MUNICIPAL;-29.689;-51.106954;Hospital;;93540-090;RUA VIDAL BRASIL, 1671 - HAMBURGO VELHO;;ATIVO
922;4314902;431490;466;Metropolitana;10;REGIÃO 10 - CAPITAL E VALE DO GRAVATAÍ;01ª CRS;Porto Alegre;2237121;HOSPITAL SANATORIO PARTENON;;HOSPITAL SANATORIO PARTENON;7;HOSPITAL ESPECIALIZADO;ADMINISTRAÇÃO PÚBLICA;MUNICIPAL;-30.063;-51.178801;Hospital;;90650-001;AV BENTO GONCALVES, 3722 - PARTENON;;ATIVO
924;4321303;432130;486;Vales;30;REGIÃO 30 - VALE DA LUZ;16ª CRS;Taquari;9563873;HOSPITAL SAO JOSE TAQUARI;;ASSOCIACAO TAQUARIENSE DE SAUDE;5;HOSPITAL GERAL;ENTIDADES SEM FINS LUCRATIVOS;MUNICIPAL;-29.802945;-51.866638;Hospital; ;95860-000;MARECHAL DEODORO, 1390 - CENTRO;;ATIVO
927;4321006;432100;475;Norte;19;REGIÃO 19 - BOTUCARAÍ;06ª CRS;Tapera;2246783;HOSPITAL ROQUE GONZALEZ - TAPERA;;SOCIEDADE HOSPITALAR ROQUE GONZALEZ;5;HOSPITAL GERAL;ENTIDADES SEM FINS LUCRATIVOS;ESTADUAL;-28.630542;-52.869092;Hospital; ;99490-000;RUA RUI BARBOSA, 265 - CENTRO;;ATIVO
941;4314308;431430;469;Missioneira;13;REGIÃO 13 - DIVERSIDADE;17ª CRS;Pejuçara;2261138;HOSPITAL PEJUCARA;;CASA BENEFICENTE DE SAUDE RIO BRANCO;5;HOSPITAL GERAL;ENTIDADES SEM FINS LUCRATIVOS;DUPLA;-28.424972;-53.656028;Hospital; ;98270-000;RUA LUIGI BASSO, 1017 - CENTRO;;ATIVO
952;4314902;431490;466;Metropolitana;10;REGIÃO 10 - CAPITAL E VALE DO GRAVATAÍ;01ª CRS;Porto Alegre;2693801;ASSOCIACAO HOSPITALAR VILA NOVA PORTO ALEGRE;;ASSOCIACAO HOSPITALAR VILA NOVA;5;HOSPITAL GERAL;ENTIDADES SEM FINS LUCRATIVOS;MUNICIPAL;-30.119341;-51.207774;Hospital; ;91750-040;RUA CATARINO ANDREATTA, 155 - VILA NOVA;20.0;ATIVO
