objectid;cod_ibge;cod_ses;cod_regiao_uf;macrorregiao_saude;regiao_saude;nome_regiao_saude;crs;municipio;cod_cnes;nome_da_unidade;telefone;nome_razao_social;cod_tipo_un;ds_tipo_un;ds_natureza;tp_gestao;latitude;longitude;equipamento;complemento;cep;endereco;adulto_leito_uti;status
963;4301305;430130;477;Sul;21;REGIÃO 21 - SUL;03ª CRS;Arroio Grande;2233428;SANTA CASA DE MISERICORDIA DE ARROIO GRANDE;;SANTA CASA DE MISERICORDIA DE ARROIO GRANDE;5;HOSPITAL GERAL;ENTIDADES SEM FINS LUCRATIVOS;ESTADUAL;-32.23105;-53.08403;Hospital; ;96330-000;RUA DR MONTEIRO, 1164 - CENTRO;;ATIVO
967;4315602;431560;477;Sul;21;REGIÃO 21 - SUL;03ª CRS;Rio Grande;2232995;SANTA CASA DO RIO GRANDE;;ASSOCIACAO DE CARIDADE SANTA CASA DO RIO GRANDE;5;HOSPITAL GERAL;ENTIDADES SEM FINS LUCRATIVOS;ESTADUAL;-32.030679;-52.10255;Hospital; ;96200-400;RUA GENERAL OSORIO, 625 - CENTRO;30.0;ATIVO
1003;4302204;430220;470;Missioneira;14;REGIÃO 14 - FRONTEIRA NOROESTE;14ª CRS;Boa Vista do Buricá;2250705;HOSPITAL DE CARIDADE BOA VISTA;;ASSOCIACAO HOSPITALAR BOA VISTA;5;HOSPITAL GERAL;ENTIDADES SEM FINS LUCRATIVOS;ESTADUAL;-27.670592;-54.11028;Hospital; ;98918-000;AV SAO JOSE, 866 - CENTRO;;ATIVO
1004;4314902;431490;466;Metropolitana;10;REGIÃO 10 - CAPITAL E VALE DO GRAVATAÍ;01ª CRS;Porto Alegre;2262568;HOSPITAL SAO LUCAS DA PUCRS;;UNIAO BRASILEIRA DE EDUCACAO E ASSISTENCIA;5;HOSPITAL GERAL;ENTIDADES SEM FINS LUCRATIVOS;MUNICIPAL;-30.055232;-51.173383;Hospital; ;90610-000;AV IPIRANGA, 6690 - JARDIM BOTANICO;5.0;ATIVO
1005;4319000;431900;482;Serra;26;REGIÃO 26 - UVA VALE;05ª CRS;São Marcos;3228630;HOSPITAL DR STICH;;NILDO SANDER STICH;22;CONSULTORIO ISOLADO;ENTIDADES EMPRESARIAIS;MUNICIPAL;-28.969367;-51.068015;Hospital; ;95190-000;RUA DR ROSA, 174 - CENTRO;;ATIVO
1013;4308508;430850;471;Norte;15;REGIÃO 15 - CAMINHO DAS ÁGUAS;02ª CRS;Frederico Westphalen;2228602;HOSPITAL DIVINA PROVIDENCIA FREDWEST;;SOC BENEF DO HOSPITAL DE CARIDADE;5;HOSPITAL GERAL;ENTIDADES SEM FINS LUCRATIVOS;ESTADUAL;-27.35645;-53.401729;Hospital;PREDIO;98400-000;RUA SETE DE SETEMBRO, 90 - CENTRO;10.0;ATIVO
1019;4318432;431843;457;Centro-Oeste;1;REGIÃO 01 - VERDES CAMPOS;04ª CRS;São João do Polêsine;6364810;HOSPITAL DR ROBERTO BINATTO;;HOSPITAL DR ROBERTO BINATTO;5;HOSPITAL GERAL;ENTIDADES SEM FINS LUCRATIVOS;ESTADUAL;-29.620251;-53.445857;Hospital; ;97230-000;RUA AUGUSTO ARNUTI, 700 - CENTRO;;ATIVO
1028;4310108;431010;462;Metropolitana;6;REGIÃO 06 - VALE DO PARANHANA E COSTA SERRA;01ª CRS;Igrejinha;2227665;HOSPITAL BOM PASTOR IGREJINHA;;ASSOCIACAO BENEFICENTE DE IGREJINHA;5;HOSPITAL GERAL;ENTIDADES SEM FINS LUCRATIVOS;ESTADUAL;-29.572503;-50.801169;Hospital; ;95650-000;RUA DR EDMUNDO LAUFFER, 351 - BOM PASTOR;;ATIVO
1056;4312500;431250;461;Metropolitana;5;REGIÃO 05 - BONS VENTOS;18ª CRS;Mostardas;2224615;HOSPITAL SAO LUIZ MOSTARDAS;;SOCIEDADE BENEFICIENTE SAO LUIZ DE MOSTARDAS;5;HOSPITAL GERAL;ENTIDADES SEM FINS LUCRATIVOS;ESTADUAL;-31.104669;-50.917099;Hospital; ;96270-000;ALMIRANTE TAMANDARE, 864 - CENTRO;;ATIVO
1057;4313102;431310;457;Centro-Oeste;1;REGIÃO 01 - VERDES CAMPOS;04ª CRS;Nova Palma;2244128;HOSPITAL NOSSA SENHORA DA PIEDADE;;ASSOCIACAO HOSPITAL NOSSA SENHORA DA PIEDADE;5;HOSPITAL GERAL;ENTIDADES SEM FINS LUCRATIVOS;ESTADUAL;-29.470083;-53.473991;Hospital; ;97250-000;RUA SILVIO GROTTO, 499 - CENTRO;;ATIVO
1063;4300802;430080;482;Serra;26;REGIÃO 26 - UVA VALE;05ª CRS;Antônio Prado;2241072;HOSPITAL SAO JOSE ANTONIO PRADO;;SOCIEDADE HOSPITALAR SAO JOSE;5;HOSPITAL GERAL;ENTIDADES SEM FINS LUCRATIVOS;MUNICIPAL;-28.85661;-51.285345;Hospital; ;95250-000;RUA DR OSVALDO HAMPE, 258 - CENTRO;;ATIVO
1091;4316303;431630;467;Missioneira;11;REGIÃO 11 - SETE POVOS DAS MISSÕES;12ª CRS;Roque Gonzales;2259974;HOSPITAL SANTO ANTONIO ROQUE GONZALES;;HOSPITAL DE CARIDADE SANTO ANTONIO;5;HOSPITAL GERAL;ENTIDADES SEM FINS LUCRATIVOS;ESTADUAL;-28.129604;-55.026366;Hospital; ;97970-000;RUA MONSENHOR WOLSKI, 117 - CENTRO;;ATIVO
1095;4306809;430680;485;Vales;29;REGIÃO 29 - VALES E MONTANHAS;16ª CRS;Encantado;2252228;HOSPITAL SANTA TERESINHA ENCANTADO;;BENEFICENCIA CAMILIANA DO SUL;5;HOSPITAL GERAL;ENTIDADES SEM FINS LUCRATIVOS;MUNICIPAL;-29.23320051;-51.88803684;Hospital; ;95960-000;JULIO DE CASTILHOS, 791 - CENTRO;;ATIVO
1112;4316808;431680;484;Vales;28;REGIÃO 28 - VINTE E OITO;13ª CRS;Santa Cruz do Sul;2255936;HOSPITAL ANA NERY;;HOSPITAL ANA NERY SANTA CRUZ DO SUL;5;HOSPITAL GERAL;ENTIDADES SEM FINS LUCRATIVOS;MUNICIPAL;-29.73771;-52.427176;Hospital; ;96835-090;RUA PEREIRA DA CUNHA, 209 - ARROIO GRANDE;7.0;ATIVO
1118;4311809;431180;473;Norte;17;REGIÃO 17 - PLANALTO;06ª CRS;Marau;9131981;HOSPITAL SAO LUCAS;;HOSPITAL SAO LUCAS LTDA;5;HOSPITAL GERAL;ENTIDADES EMPRESARIAIS;MUNICIPAL;-28.453967;-52.200242;Hospital;PAVMTO02;99150-000;BARAO DO RIO BRANCO, 1751 - CENTRO;;ATIVO
1128;4309704;430970;469;Missioneira;13;REGIÃO 13 - DIVERSIDADE;17ª CRS;Humaitá;2265893;HOSPITAL ADESCO;;ASSOCIACAO DE DESENVOLVIMENTO COMUNITARIO DE HUMAITA;5;HOSPITAL GERAL;ENTIDADES SEM FINS LUCRATIVOS;DUPLA;-27.56682;-53.971763;Hospital; ;98670-000;RUA JOAO PESSOA, 399 - CENTRO;;ATIVO
1130;4315404;431540;476;Norte;20;REGIÃO 20 - ROTA DA PRODUÇÃO;15ª CRS;Redentora;2235455;PRONTO ATENDIMENTO DE URGENCIA;;VIEIRA GUERREIRO E SEGURA LTDA;5;HOSPITAL GERAL;ADMINISTRAÇÃO PÚBLICA;MUNICIPAL;-27.6622208;-53.638743;Hospital;CASA;98550-000;AVENIDA PRESIDENTE CASTELO BRANCO, 55 - CENTRO;;ATIVO
1139;4313409;431340;463;Metropolitana;7;REGIÃO 07 - VALE DOS SINOS;01ª CRS;Novo Hamburgo;3213943;HOSPITAL UNIMED VALE DO SINOS TORRE I NOVO HAMBURGO;;UNIMED VALE DOS SINOS SOCIEDADE COOP DE TRAB MED LTDA;5;HOSPITAL GERAL;ENTIDADES EMPRESARIAIS;MUNICIPAL;-29.688652;-51.107089;Hospital; ;93540-300;RUA WALDEMAR GEIB, 161 - CANUDOS;7.0;ATIVO
1140;4300208;430020;469;Missioneira;13;REGIÃO 13 - DIVERSIDADE;17ª CRS;Ajuricaba;2265885;HOSPITAL AJURICABA;;ASSOCIACAO HOSPITALAR BENEFICENTE AJURICABA;5;HOSPITAL GERAL;ENTIDADES SEM FINS LUCRATIVOS;ESTADUAL;-28.235552;-53.76836;Hospital; ;98750-000;RUA FLORIANO PEIXOTO, 50 - PLANALTO;;ATIVO
1147;4322608;432260;484;Vales;28;REGIÃO 28 - VINTE E OITO;13ª CRS;Venâncio Aires;2236370;HOSPITAL SAO SEBASTIAO MARTIR;;HOSPITAL SAO SEBASTIAO MARTIR;5;HOSPITAL GERAL;ENTIDADES SEM FINS LUCRATIVOS;MUNICIPAL;-29.607657;-52.191095;Hospital; ;95800-000;RUA TIRADENTES, 834 - CENTRO;10.0;ATIVO
1157;4313656;431365;461;Metropolitana;5;REGIÃO 05 - BONS VENTOS;18ª CRS;Palmares do Sul;2224607;HOSPITAL SAO JOSE PALMARES DO SUL;;SOCIEDADE BENEFICENTE SAO JOSE;5;HOSPITAL GERAL;ENTIDADES SEM FINS LUCRATIVOS;ESTADUAL;-30.264523;-50.511876;Hospital; ;95540-000;RUA FIRMIANO OSORIO, 60 - CENTRO;;ATIVO
1204;4313409;431340;463;Metropolitana;7;REGIÃO 07 - VALE DOS SINOS;01ª CRS;Novo Hamburgo;2231611;INSTITUTO DE TRATAMENTO CARDIOVASCULAR LTDA;;INSTITUTO DE TRATAMENTO CARDIOVASCULAR LTDA;62;HOSPITAL/DIA - ISOLADO;ENTIDADES EMPRESARIAIS;MUNICIPAL;-29.6755968;-51.1324262;Hospital;FUNDOS;93315-544;AVENIDA PEDRO ADAMS FILHO, 6520 - OPERARIO;;ATIVO
1211;4310850;431085;476;Norte;20;REGIÃO 20 - ROTA DA PRODUÇÃO;15ª CRS;Jaboticaba;2235315;HOSPITAL SANTA RITA D JABOTICABA;;ASSOCIACAO HOSPITALAR SANTA RITA;5;HOSPITAL GERAL;ENTIDADES SEM FINS LUCRATIVOS;DUPLA;-27.633003;-53.27589;Hospital;CASA;98350-000;RUA THEODORO SYBERICHS, 548 - CENTRO;;ATIVO
1219;4315701;431570;484;Vales;28;REGIÃO 28 - VINTE E OITO;13ª CRS;Rio Pardo;2792974;HOSPITAL DOS PASSOS;;FUNDACAO HOSPITALAR GETULIO VARGAS;5;HOSPITAL GERAL;ENTIDADES SEM FINS LUCRATIVOS;ESTADUAL;-29.984678;-52.371335;Hospital; ;96640-000;PRACA CORONEL PEREIRA REGO, 30 - AUXILIADORA;;ATIVO
1229;4300703;430070;485;Vales;29;REGIÃO 29 - VALES E MONTANHAS;16ª CRS;Anta Gorda;9309470;HOSPITAL PADRE CATELLI;;ASSOCIACAO HOSPITALAR PADRE HERMINIO CATELLI;5;HOSPITAL GERAL;ENTIDADES SEM FINS LUCRATIVOS;MUNICIPAL;-28.97288;-52.005098;Hospital; ;95980-000;RUA ARMINHO MIOTTO, 1032 - CENTRO;;ATIVO
1232;4322533;432253;484;Vales;28;REGIÃO 28 - VINTE E OITO;13ª CRS;Vale do Sol;2236338;HOSPITAL VALE DO SOL;;HOSPITAL BENEFICENTE VALE DO SOL HBVS;5;HOSPITAL GERAL;ENTIDADES SEM FINS LUCRATIVOS;ESTADUAL;-29.604891;-52.687756;Hospital; ;96878-000;RUA LINDOLFO MACHADO, 36 - CENTRO;;ATIVO
1246;4314407;431440;477;Sul;21;REGIÃO 21 - SUL;03ª CRS;Pelotas;7701942;COMPLEXO DE SAUDE UNIMED PELOTAS;;UNIMED PELOTAS RS COOPERATIVA DE ASSISTENCIA A SAUDE LTDA;5;HOSPITAL GERAL;ENTIDADES EMPRESARIAIS;MUNICIPAL;-31.7348132;-52.3474647;Hospital;;96055-120;DR GERALDO TREPTOW, 250 - TRES VENDAS;;ATIVO
1254;4314407;431440;477;Sul;21;REGIÃO 21 - SUL;03ª CRS;Pelotas;2253046;HOSPITAL UNIVERSITARIO SAO FRANCISCO DE PAULA;;SOCIEDADE PELOTENSE DE ASSISTENCIA E CULTURA;5;HOSPITAL GERAL;ENTIDADES SEM FINS LUCRATIVOS;MUNICIPAL;-31.757481;-52.340619;Hospital; ;96020-220;RUA MARECHAL DEODORO, 1123 - CENTRO;20.0;ATIVO
1258;4317103;431710;459;Centro-Oeste;3;REGIÃO 03 - FRONTEIRA OESTE;10ª CRS;Santana do Livramento;5395194;PRONTOMED CTI CENTRO DE TRATAMENTO INTENSIVO LTDA;;PRONTOMED CTI CENTRO DE TRATAMENTO INTENSIVO LTDA;7;HOSPITAL ESPECIALIZADO;ENTIDADES EMPRESARIAIS;MUNICIPAL;-30.898776;-55.529719;Hospital;SALA 05;97574-210;AV ALMIRANTE TAMANDARE, 2880 - CENTRO;6.0;ATIVO
1278;4320677;432067;484;Vales;28;REGIÃO 28 - VINTE E OITO;13ª CRS;Sinimbu;2236346;HOSPITAL SINIMBU;;HOSPITAL BENFICENTE SINIMBU;5;HOSPITAL GERAL;ENTIDADES SEM FINS LUCRATIVOS;MUNICIPAL;-29.534921;-52.521335;Hospital; ;96890-000;RUA BERNARDO FUERSTENAU, 477 - CENTRO;;ATIVO
1279;4317202;431720;470;Missioneira;14;REGIÃO 14 - FRONTEIRA NOROESTE;14ª CRS;Santa Rosa;3017060;HOSPITAL VIDA SAUDE FILIAL 01;;ASSOCIACAO BENEFICENTE DOM BOSCO;5;HOSPITAL GERAL;ENTIDADES SEM FINS LUCRATIVOS;MUNICIPAL;-27.87191;-54.476292;Hospital;PREDIO;98900-000;RUA SANTA ROSA, 980 - CENTRO;10.0;ATIVO
1283;4316907;431690;457;Centro-Oeste;1;REGIÃO 01 - VERDES CAMPOS;04ª CRS;Santa Maria;2244144;HOSPITAL DA BRIGADA MILITAR DE SANTA MARIA;;HOSPITAL DA BRIGADA MILITAR DE SANTA MARIA;5;HOSPITAL GERAL;ENTIDADES SEM FINS LUCRATIVOS;MUNICIPAL;-29.6873648;-53.7922962;Hospital;;97045-100;RUA EUCLIDES DA CUNHA, 1800 - N S DAS DORES;;ATIVO
1303;4304606;430460;464;Metropolitana;8;REGIÃO 08 - VALE DO CAÍ E METROPOLITANA;01ª CRS;Canoas;9679774;COMPLEXO LIBERTAD;51 34111008;LIBERTAD ASSISTENCIA EM SAUDE MENTAL LTDA;7;HOSPITAL ESPECIALIZADO;ENTIDADES EMPRESARIAIS;MUNICIPAL;-29.901594;-51.173793;Hospital;;92410-000;RUA ARAGUAIA, 335 - IGARA;;ATIVO
1304;4308904;430890;472;Norte;16;REGIÃO 16 - ALTO URUGUAI GAÚCHO;11ª CRS;Getúlio Vargas;2249510;HOSPITAL SAO ROQUE DE GETULIO VARGAS;;HOSPITAL SAO ROQUE DE GETULIO VARGAS;5;HOSPITAL GERAL;ENTIDADES SEM FINS LUCRATIVOS;ESTADUAL;-27.884086;-52.223151;Hospital; ;99900-000;RUA JACOB GREMMELAMIER, 212 - CENTRO;;ATIVO
1310;4313201;431320;479;Serra;23;REGIÃO 23 - CAXIAS E HORTÊNSIAS;05ª CRS;Nova Petrópolis;2241102;HOSPITAL NOVA PETROPOLIS;;ORDEM AUXILIADORA SENHORAS ENVANGELICAS NOVA PETROPOLIS;5;HOSPITAL GERAL;ENTIDADES SEM FINS LUCRATIVOS;MUNICIPAL;-29.374175;-51.117774;Hospital; ;95150-000;RUA PASTOR H HUNSCHE, 823 - CENTRO;;ATIVO
1339;4304903;430490;473;Norte;17;REGIÃO 17 - PLANALTO;06ª CRS;Casca;2246872;HOSPITAL BENEFICENTE SANTA LUCIA - CASCA;;HOSPITAL BENEFICENTE SANTA LUCIA;5;HOSPITAL GERAL;ENTIDADES SEM FINS LUCRATIVOS;ESTADUAL;-28.56653;-51.976172;Hospital; ;99260-000;RUA VITORINO MONTEIRO, 755 - CENTRO;;ATIVO
1364;4308706;430870;472;Norte;16;REGIÃO 16 - ALTO URUGUAI GAÚCHO;11ª CRS;Gaurama;2249545;HOSPITAL SANTA ISABEL GAURAMA;;ASSOCIACAO EDUCACIONAL E CARITATIVA HOSP STA ISABEL GAURAMA;5;HOSPITAL GERAL;ENTIDADES SEM FINS LUCRATIVOS;DUPLA;-27.5861;-52.100833;Hospital; ;99830-000;RUA JOSE SPONCHIADO, 690 - CENTRO;;ATIVO
1380;4314902;431490;466;Metropolitana;10;REGIÃO 10 - CAPITAL E VALE DO GRAVATAÍ;01ª CRS;Porto Alegre;4372336;HOSPITAL DOCTOR CLIN;;INSTITUTO DE ASSISTENCIA A SAUDE LTDA;5;HOSPITAL GERAL;ENTIDADES EMPRESARIAIS;MUNICIPAL;-30.0476315;-51.2002024;Hospital;;90640002;AVENIDA VICENTE DA FONTOURA, 1470 - SANTANA;;ATIVO
1394;4314902;431490;466;Metropolitana;10;REGIÃO 10 - CAPITAL E VALE DO GRAVATAÍ;01ª CRS;Porto Alegre;7513151;HOSPITAL RESTINGA E EXTREMO SUL;;ASSOCIACAO HOSPITALAR MOINHOS DE VENTO;5;HOSPITAL GERAL;ENTIDADES SEM FINS LUCRATIVOS;MUNICIPAL;-30.142609;-51.128625;Hospital; ;91790-000;ESTRADA JOAO ANTONIO DA SILVEIRA, 3330 - RESTINGA;10.0;ATIVO
1397;4312203;431220;474;Norte;18;REGIÃO 18 - ARAUCÁRIAS;06ª CRS;Maximiliano de Almeida;2247038;HOSPITAL SAO JOSE - MAXIMILIANO DE ALMEIDA;;SOCIEDADE BENEFICENTE SAO JOSE;5;HOSPITAL GERAL;ENTIDADES SEM FINS LUCRATIVOS;ESTADUAL;-27.641966;-51.800168;Hospital; ;99890-000;RUA VITORIO SETTI, 195 - CENTRO;;ATIVO
1411;4304606;430460;464;Metropolitana;8;REGIÃO 08 - VALE DO CAÍ E METROPOLITANA;01ª CRS;Canoas;3626245;HOSPITAL PRONTO SOCORRO DE CANOAS DEP NELSON MARCHEZAN;;ASSOCIACAO EDUCADORA SAO CARLOS AESC;7;HOSPITAL ESPECIALIZADO;ADMINISTRAÇÃO PÚBLICA;MUNICIPAL;-29.906418;-51.198125;Hospital; ;92330-290;RUA CACAPAVA, 100 - MATHIAS VELHO;10.0;ATIVO
1437;4316402;431640;459;Centro-Oeste;3;REGIÃO 03 - FRONTEIRA OESTE;10ª CRS;Rosário do Sul;2248239;HOSPITAL AUXILIADORA;(55) 3231-2700;HOSPITAL DE CARIDADE NOSSA SENHORA AUXILIADORA;5;HOSPITAL GERAL;ENTIDADES SEM FINS LUCRATIVOS;ESTADUAL;-30.252026;-54.916635;Hospital; ;97590-000;RUA SETE DE SETEMBRO, 2257 - CENTRO;8.0;ATIVO
1447;4305306;430530;476;Norte;20;REGIÃO 20 - ROTA DA PRODUÇÃO;15ª CRS;Chapada;2235307;HOSPITAL SAO JOSE CHAPADA;;SOCIEDADE BENEFICENTE SAO JOSE;5;HOSPITAL GERAL;ENTIDADES SEM FINS LUCRATIVOS;DUPLA;-28.054919;-53.065756;Hospital; ;99530-000;RUA DUQUE DE CAXIAS, 368 - CENTRO;;ATIVO
1470;4305405;430540;469;Missioneira;13;REGIÃO 13 - DIVERSIDADE;17ª CRS;Chiapetta;2261103;HOSPITAL DE CHIAPETTA;;SOCIEDADE HOSPITALAR BENEFICENTE CHIAPETTA;5;HOSPITAL GERAL;ENTIDADES SEM FINS LUCRATIVOS;ESTADUAL;-27.921145;-53.941262;Hospital; ;98760-000;RUA TOMAZIO DE CARVALHO, 977 - CENTRO;;ATIVO
1483;4305108;430510;479;Serra;23;REGIÃO 23 - CAXIAS E HORTÊNSIAS;05ª CRS;Caxias do Sul;2223562;HOSPITAL VIRVI RAMOS;;ASSOCIACAO CULTURAL E CIENTIFICA VIRVI RAMOS;5;HOSPITAL GERAL;ENTIDADES SEM FINS LUCRATIVOS;MUNICIPAL;-29.154509;-51.180093;Hospital; ;95041-520;RUA ALEXANDRE FLEMING, 454 - MADUREIRA;10.0;ATIVO
1485;4315305;431530;459;Centro-Oeste;3;REGIÃO 03 - FRONTEIRA OESTE;10ª CRS;Quaraí;2248247;FUNDACAO HOSPITALAR DE CARIDADE DE QUARAI;;FUNDACAO HOSPITALAR DE CARIDADE DE QUARAI;5;HOSPITAL GERAL;ENTIDADES SEM FINS LUCRATIVOS;MUNICIPAL;-30.378792;-56.460824;Hospital; ;97560-000;RUA ASCANIO TUBINO, 780 - CENTRO;;ATIVO
1507;4302303;430230;480;Serra;24;REGIÃO 24 - CAMPOS DE CIMA DA SERRA;05ª CRS;Bom Jesus;6011926;HOSPITAL DE BOM JESUS;;INSTITUTO DE SAUDE E EDUCACAO VIDA;5;HOSPITAL GERAL;ENTIDADES SEM FINS LUCRATIVOS;MUNICIPAL;-28.665592;-50.437481;Hospital; ;95290-000;AV MANOEL SILVEIRA DE AZEVEDO, 2521 - CENTRO;;ATIVO
1508;4304002;430400;469;Missioneira;13;REGIÃO 13 - DIVERSIDADE;17ª CRS;Campo Novo;2261154;HOSPICAMPO;;ASSOCIACAO HOSPITALAR DE CARIDADE DE CAMPO NOVO;5;HOSPITAL GERAL;ENTIDADES SEM FINS LUCRATIVOS;DUPLA;-27.683501;-53.808175;Hospital; ;98570-000;RUA HERMOGINES PAHIS, 105 - CENTRO;;ATIVO
1513;4321402;432140;471;Norte;15;REGIÃO 15 - CAMINHO DAS ÁGUAS;02ª CRS;Tenente Portela;5384117;HOSPITAL SANTO ANTONIO TENENTE PORTELA;;ASSOCIACAO HOSPITALAR BENEFICIENTE SANTO ANTONIO;5;HOSPITAL GERAL;ENTIDADES SEM FINS LUCRATIVOS;ESTADUAL;-27.370224;-53.758491;Hospital;PREDIO;98500-000;RUA ROMARIO ROSA LOPES, 42 - CENTRO;10.0;ATIVO
1515;4311304;431130;474;Norte;18;REGIÃO 18 - ARAUCÁRIAS;06ª CRS;Lagoa Vermelha;3819590;HOSPITAL SAO PAULO;;FUNDACAO ARAUCARIA;5;HOSPITAL GERAL;ENTIDADES SEM FINS LUCRATIVOS;ESTADUAL;-28.206479;-51.531653;Hospital; ;95300-000;AV NIVIO CASTELANO, 1271 - CENTRO;;ATIVO
1521;4313409;431340;463;Metropolitana;7;REGIÃO 07 - VALE DOS SINOS;01ª CRS;Novo Hamburgo;2232057;HOSPITAL REGINA NOVO HAMBURGO;;ASSOCIACAO CONGREGACAO DE SANTA CATARINA;5;HOSPITAL GERAL;ENTIDADES SEM FINS LUCRATIVOS;MUNICIPAL;-29.678212;-51.115548;Hospital; ;93510-250;AV DR MAURICIO CARDOSO, 711 - HAMBURGO VELHO;17.0;ATIVO
1538;4320404;432040;473;Norte;17;REGIÃO 17 - PLANALTO;06ª CRS;Serafina Corrêa;2260050;HOSPITAL NOSSA SENHORA DO ROSARIO;;HOSPITAL NOSSA SENHORA DO ROSARIO;5;HOSPITAL GERAL;ENTIDADES SEM FINS LUCRATIVOS;MUNICIPAL;-28.71173;-51.936142;Hospital; ;99250-000;RUA MONSENHOR JOAO BAPTISTA SCALABRINI, 260 - CENTRO;;ATIVO
1540;4323002;432300;466;Metropolitana;10;REGIÃO 10 - CAPITAL E VALE DO GRAVATAÍ;01ª CRS;Viamão;5223962;INSTITUTO DE CARDIOLOGIA HOSPITAL VIAMAO;;FUNDACAO UNIVERSITARIA DE CARDIOLOGIA;5;HOSPITAL GERAL;ENTIDADES SEM FINS LUCRATIVOS;ESTADUAL;-30.081732;-51.030015;Hospital; ;94410-250;RUA ISABEL BASTOS, 137 - CENTRO;15.0;ATIVO
1542;4315156;431515;485;Vales;29;REGIÃO 29 - VALES E MONTANHAS;16ª CRS;Progresso;2252082;HOSPITAL SANTA ISABEL -PROGRESSO;;SOCIEDADE SULINA DIVINA PROVIDENCIA;5;HOSPITAL GERAL;ENTIDADES SEM FINS LUCRATIVOS;MUNICIPAL;-29.242395;-52.309578;Hospital;PREDIO HSI;95925-000;RUA CORONEL FETT FILHO, 50 - CENTRO;;ATIVO
1554;4312104;431210;458;Centro-Oeste;2;REGIÃO 02 - ENTRE RIOS;04ª CRS;Mata;2244187;HOSPITAL DE MATA;;HOSPITAL DE CARIDADE DE MATA;5;HOSPITAL GERAL;ENTIDADES SEM FINS LUCRATIVOS;ESTADUAL;-29.565508;-54.462224;Hospital; ;97410-000;RUA GENERAL OSORIO, 208 - CENTRO;;ATIVO
1562;4314902;431490;466;Metropolitana;10;REGIÃO 10 - CAPITAL E VALE DO GRAVATAÍ;01ª CRS;Porto Alegre;4521218;DAY HOSPITAL MOINHOS DE VENTO PONTAL C CIRURG AMBUL;;ASSOCIACAO HOSPITALAR MOINHOS DE VENTO;62;HOSPITAL/DIA - ISOLADO;ENTIDADES SEM FINS LUCRATIVOS;MUNICIPAL;-30.0793103;-51.2473909;Hospital;BLOCO HUB 5;90810240;AVENIDA PADRE CACIQUE, 2893 - CRISTAL;;ATIVO
1576;4310009;431000;468;Missioneira;12;REGIÃO 12 - PORTAL DAS MISSÕES;09ª CRS;Ibirubá;5395674;HOSPITAL ANNES DIAS;;ASSOCIACAO HOSPITALAR ANNES DIAS;5;HOSPITAL GERAL;ENTIDADES SEM FINS LUCRATIVOS;ESTADUAL;-28.632556;-53.090207;Hospital; ;98200-000;RUA DINIZ DIAS, 309 - CENTRO;;ATIVO
1603;4305108;430510;479;Serra;23;REGIÃO 23 - CAXIAS E HORTÊNSIAS;05ª CRS;Caxias do Sul;2223570;HOSPITAL DO CIRCULO;;CIRCULO OPERARIO CAXIENSE;5;HOSPITAL GERAL;ENTIDADES SEM FINS LUCRATIVOS;MUNICIPAL;-29.153503;-51.173433;Hospital; ;95040-000;RUA ARCY DA ROCHA NOBREGA, 421 - JARDIM MARGARIDA;18.0;ATIVO
1604;4317202;431720;470;Missioneira;14;REGIÃO 14 - FRONTEIRA NOROESTE;14ª CRS;Santa Rosa;2254611;HOSPITAL VIDA SAUDE;;ASSOCIACAO HOSPITAL CARIDADE SANTA ROSA;5;HOSPITAL GERAL;ENTIDADES SEM FINS LUCRATIVOS;MUNICIPAL;-27.866829;-54.485054;Hospital;CASA;98900-000;RUA DR FRANCISCO TIMM, 656 - CENTRO;10.0;ATIVO
1613;4303905;430390;463;Metropolitana;7;REGIÃO 07 - VALE DOS SINOS;01ª CRS;Campo Bom;2232073;HOSPITAL DE CAMPO BOM DR LAURO REUS;;HOSPITAL DE CARIDADE SAO ROQUE;5;HOSPITAL GERAL;ENTIDADES SEM FINS LUCRATIVOS;MUNICIPAL;-29.68748;-51.054845;Hospital; ;93700-000;RUA OSVALDO CRUZ, 116 - BELA VISTA;10.0;ATIVO
1615;4301008;430100;485;Vales;29;REGIÃO 29 - VALES E MONTANHAS;16ª CRS;Arroio do Meio;2252198;HOSPITAL SAO JOSE ARROIO DO MEIO;;SOCIEDADE SULINA DIVINA PROVIDENCIA;5;HOSPITAL GERAL;ENTIDADES SEM FINS LUCRATIVOS;MUNICIPAL;-29.401473;-51.947323;Hospital; ;95940-000;RUA JULIO DE CASTILHOS, 314 - CENTRO;;ATIVO
1621;4315107;431510;467;Missioneira;11;REGIÃO 11 - SETE POVOS DAS MISSÕES;12ª CRS;Porto Xavier;2259982;HOSPITAL DE PORTO XAVIER;;ASSOCIACAO HOSPITAL DE CARIDADE NOSSA SENHORA DOS NAVEGANTES;5;HOSPITAL GERAL;ENTIDADES SEM FINS LUCRATIVOS;ESTADUAL;-27.90336834;-55.13931742;Hospital; ;98995-000;RUA OSVALDO CRUZ, 555 - CENTRO;;ATIVO
1670;4321204;432120;462;Metropolitana;6;REGIÃO 06 - VALE DO PARANHANA E COSTA SERRA;01ª CRS;Taquara;2227932;HOSPITAL BOM JESUS;;ASSOCIACAO EDUCADORA SAO CARLOS AESC;5;HOSPITAL GERAL;ENTIDADES SEM FINS LUCRATIVOS;ESTADUAL;-29.644191;-50.778406;Hospital; ;95600-000;R EMILIO LUCIO ESTEVES, 1042 - SAGRADA FAMILIA;;ATIVO
1677;4305108;430510;479;Serra;23;REGIÃO 23 - CAXIAS E HORTÊNSIAS;05ª CRS;Caxias do Sul;2223589;CLINICA PROFESSOR PAULO GUEDES LTDA;;CLINICA PROFESSOR PAULO GUEDES LTDA;7;HOSPITAL ESPECIALIZADO;ENTIDADES EMPRESARIAIS;MUNICIPAL;-29.1135281;-51.0888787;Hospital;;95060-000;AVENIDA RIO BRANCO, 1554 - ANA RECH;;ATIVO
1687;4314902;431490;466;Metropolitana;10;REGIÃO 10 - CAPITAL E VALE DO GRAVATAÍ;01ª CRS;Porto Alegre;2237601;HOSPITAL DE CLINICAS;;HOSPITAL DE CLINICAS DE PORTO ALEGRE;5;HOSPITAL GERAL;ENTIDADES EMPRESARIAIS;MUNICIPAL;-30.038638;-51.206436;Hospital;LARGO EDUARDO FARACO;90035-903;RUA RAMIRO BARCELOS, 2350 - SANTANA;82.0;ATIVO
1688;4311809;431180;473;Norte;17;REGIÃO 17 - PLANALTO;06ª CRS;Marau;2246953;HOSPITAL CRISTO REDENTOR - MARAU;;ASSOCIACAO HOSPITALAR BENEFICENTE DE MARAU;5;HOSPITAL GERAL;ENTIDADES SEM FINS LUCRATIVOS;ESTADUAL;-28.447042;-52.193964;Hospital; ;99150-000;RUA BENTO GONCALVES, 10 - CENTRO;;ATIVO
1690;4314902;431490;466;Metropolitana;10;REGIÃO 10 - CAPITAL E VALE DO GRAVATAÍ;01ª CRS;Porto Alegre;3567664;HOSPITAL ERNESTO DORNELLES;;HOSPITAL ERNESTO DORNELLES;5;HOSPITAL GERAL;ENTIDADES SEM FINS LUCRATIVOS;MUNICIPAL;-30.047492;-51.211891;Hospital; ;90160-093;AV IPIRANGA, 1801 - AZENHA;40.0;ATIVO
1701;4305900;430590;476;Norte;20;REGIÃO 20 - ROTA DA PRODUÇÃO;15ª CRS;Coronel Bicaco;2235382;ASSOC HOSP SANTO ANTONIO DE PADUA;;ASSOC HOSP SANTO ANTONIO DE PADUA;5;HOSPITAL GERAL;ENTIDADES SEM FINS LUCRATIVOS;ESTADUAL;-27.715877;-53.702126;Hospital; ;98580-000;RUA FRANCISCO GOBBI, 510 - CENTRO;;ATIVO
1704;4319109;431910;469;Missioneira;13;REGIÃO 13 - DIVERSIDADE;17ª CRS;São Martinho;2707608;HOSPITAL DE CARIDADE DE SAO MARTINHO;;SOCIEDADE CULTURAL SAO GREGORIO;5;HOSPITAL GERAL;ENTIDADES SEM FINS LUCRATIVOS;DUPLA;-27.708065;-53.964652;Hospital; ;98690-000;AV GETULIO VARGAS, 690 - CENTRO;;ATIVO
1719;4314407;431440;477;Sul;21;REGIÃO 21 - SUL;03ª CRS;Pelotas;630284;CENTRO CLINICO PILTCHER LTDA;;CENTRO CLINICO PILTCHER LTDA;5;HOSPITAL GERAL;ENTIDADES EMPRESARIAIS;MUNICIPAL;-31.75799;-52.3374745;Hospital;;96020-080;ANDRADE NEVES, 3006 - CENTRO;;ATIVO
1722;4315206;431520;485;Vales;29;REGIÃO 29 - VALES E MONTANHAS;16ª CRS;Putinga;2252171;HOSPITAL DOUTOR OSCAR BENEVOLO;;ASSOCIACAO HOSPITALAR DOUTOR OSCAR BENEVOLO;5;HOSPITAL GERAL;ENTIDADES SEM FINS LUCRATIVOS;MUNICIPAL;-29.002048;-52.15951;Hospital; ;95975-000;RUA JULIO DE CASTILHOS, 452 - CENTRO;;ATIVO
1724;4322202;432220;457;Centro-Oeste;1;REGIÃO 01 - VERDES CAMPOS;04ª CRS;Tupanciretã;2244225;HOSPITAL DE CARIDADE BRASILINA TERRA;;ASSOCIACAO PROTETORA HOSPITAL DE CARIDADE BRAZILINA TERRA;5;HOSPITAL GERAL;ENTIDADES SEM FINS LUCRATIVOS;ESTADUAL;-29.071557;-53.848879;Hospital; ;98170-000;AVN RIO BRANCO, 2 - CENTRO;;ATIVO
1735;4314407;431440;477;Sul;21;REGIÃO 21 - SUL;03ª CRS;Pelotas;2252295;SOCIEDADE PORTUGUESA DE BENEFICENCIA;;SOCIEDADE PORTUGUESA DE BENEFICENCIA;5;HOSPITAL GERAL;ENTIDADES SEM FINS LUCRATIVOS;MUNICIPAL;-31.77518;-52.345889;Hospital; ;96020-080;RUA ANDRADE NEVES, 915 - CENTRO;20.0;ATIVO
1752;4302808;430280;483;Vales;27;REGIÃO 27 - JACUÍ CENTRO;08ª CRS;Caçapava do Sul;2234416;HOSPITAL DE CARIDADE DR VICTOR LANG;;ASSOCIACAO HOSPITAL DE CARIDADE DR VICTOR LANG;5;HOSPITAL GERAL;ENTIDADES SEM FINS LUCRATIVOS;ESTADUAL;-30.516465;-53.4883;Hospital; ;96570-000;AV CORONEL CORIOLANO CASTRO, 920 - CENTRO;;ATIVO
1753;4306106;430610;468;Missioneira;12;REGIÃO 12 - PORTAL DAS MISSÕES;09ª CRS;Cruz Alta;2263823;HOSPITAL SANTA LUCIA LTDA;;HOSPITAL SANTA LUCIA LTDA;5;HOSPITAL GERAL;ENTIDADES EMPRESARIAIS;MUNICIPAL;-28.639636;-53.607762;Hospital; ;98025-220;R CORONEL PILLAR, 748 - CENTRO;12.0;ATIVO
1759;4301602;430160;478;Sul;22;REGIÃO 22 - PAMPA;07ª CRS;Bagé;2261995;HOSPITAL UNIVERSITARIO URCAMP;;HOSPITAL UNIVERSITARIO URCAMP;5;HOSPITAL GERAL;ENTIDADES SEM FINS LUCRATIVOS;ESTADUAL;-31.3329856;-54.1026512;Hospital; ;96400-350;RUA FLORES DA CUNHA, 169 - CENTRO;;ATIVO
1763;4316105;431610;476;Norte;20;REGIÃO 20 - ROTA DA PRODUÇÃO;15ª CRS;Ronda Alta;2235420;ASSOCIACAO HOSPITALAR DE RONDA ALTA;;ASSOCIACAO HOSPITALAR DE RONDA ALTA;5;HOSPITAL GERAL;ENTIDADES SEM FINS LUCRATIVOS;ESTADUAL;-27.782808;-52.801821;Hospital;PREDIO;99670-000;TRAVESSA SAO JORGE, 38 - CENTRO;;ATIVO
1768;4307005;430700;472;Norte;16;REGIÃO 16 - ALTO URUGUAI GAÚCHO;11ª CRS;Erechim;2707918;FUNDACAO HOSPITALAR SANTA TEREZINHA DE ERECHIM;;FUNDACAO HOSPITALAR SANTA TEREZINHA DE ERECHIM;5;HOSPITAL GERAL;ADMINISTRAÇÃO PÚBLICA;DUPLA;-27.635994;-52.282919;Hospital; ;99700-048;RUA ITALIA, 919 - CENTRO;16.0;ATIVO
1773;4319802;431980;458;Centro-Oeste;2;REGIÃO 02 - ENTRE RIOS;04ª CRS;São Vicente do Sul;2244136;HOSPITAL DE SAO VICENTE DO SUL;;PREFEITURA MUNICIPAL DE SAO VICENTE DO SUL;63;HOSPITAL/DIA - ISOLADO;ADMINISTRAÇÃO PÚBLICA;ESTADUAL;-29.695094;-54.671594;Hospital; ;97420-000;RUA ANTONIO GOMES, 386 - CENTRO;;ATIVO
1774;4305108;430510;479;Serra;23;REGIÃO 23 - CAXIAS E HORTÊNSIAS;05ª CRS;Caxias do Sul;3356868;HOSPITAL UNIMED CAXIAS DO SUL;;UNIMED NORDESTE RS SOCIEDADE COOPERATIVA DE SMEDLTDA;5;HOSPITAL GERAL;ENTIDADES EMPRESARIAIS;MUNICIPAL;-29.16466;-51.200877;Hospital; ;95013-000;RUA CARLOS BIANCHINI, 1744 - MARECHAL FLORIANO;20.0;ATIVO
1782;4302402;430240;486;Vales;30;REGIÃO 30 - VALE DA LUZ;16ª CRS;Bom Retiro do Sul;2252023;HOSPITAL DE CARIDADE SANTANA BOM RETIRO DO SUL;;ASSOCIACAO CRUZEIRAS DE SAO FRANCISCO;5;HOSPITAL GERAL;ENTIDADES SEM FINS LUCRATIVOS;MUNICIPAL;-29.603367;-51.940664;Hospital; ;95870-000;RUA ANTONIO MORAES VIEGAS, 133 - CENTRO;;ATIVO
1786;4314472;431447;457;Centro-Oeste;1;REGIÃO 01 - VERDES CAMPOS;04ª CRS;Pinhal Grande;2244209;CASA DE SAUDE SAO JOSE;;CASA DE SAUDE SAO JOSE;5;HOSPITAL GERAL;ENTIDADES SEM FINS LUCRATIVOS;ESTADUAL;-29.347122;-53.307757;Hospital; ;98150-000;RUA CEZAR RUBIN, 324 - CENTRO;;ATIVO
1788;4304630;430463;460;Metropolitana;4;REGIÃO 04 - BELAS PRAIAS;18ª CRS;Capão da Canoa;2707969;HOSPITAL BENEFICIENTE SANTA LUZIA;;ASSOCIACAO EDUCADORA SAO CARLOS AESC;5;HOSPITAL GERAL;ENTIDADES SEM FINS LUCRATIVOS;ESTADUAL;-29.765551;-50.02426;Hospital; ;95555-000;RUA DOM LUIZ GUANELLA, 2864 - GIRASSOL;10.0;ATIVO
